{
  "schema_version": 1,
  "engine": "appsec-analyzer",
  "interface_versions": [1],
  "required_commands": ["version", "capabilities", "repo-profile"],
  "required_capabilities": {"repo_profile": {"available": true, "model_calls": false}},
  "model_prerequisites": [],
  "optional_tools": ["Git, only to report tracked versus untracked files"],
  "qualification": "offline-workflow; no model qualification implied"
}
