{
  "schema_version": 1,
  "engine": "appsec-analyzer",
  "interface_versions": [1],
  "required_commands": ["version", "capabilities", "score"],
  "required_capabilities": {"score": {"available": true, "model_calls": false, "scoring_version": 2}},
  "model_prerequisites": [],
  "optional_tools": ["Git remote access only for an explicitly selected remote repository"],
  "qualification": "offline-workflow; no model qualification implied"
}
